{
  "$type": "Il2CppAssets.Scripts.Models.Rounds.RoundModel, Assembly-CSharp",
  "groups": [
    {
      "$type": "Il2CppAssets.Scripts.Models.Rounds.BloonGroupModel, Assembly-CSharp",
      "bloon": "ZomgFortified",
      "start": 0.0,
      "end": 2700.0,
      "count": 12,
      "name": ""
    },
    {
      "$type": "Il2CppAssets.Scripts.Models.Rounds.BloonGroupModel, Assembly-CSharp",
      "bloon": "BfbFortified",
      "start": 90.0,
      "end": 2790.0,
      "count": 12,
      "name": ""
    },
    {
      "$type": "Il2CppAssets.Scripts.Models.Rounds.BloonGroupModel, Assembly-CSharp",
      "bloon": "MoabFortified",
      "start": 360.0,
      "end": 3060.0,
      "count": 24,
      "name": ""
    }
  ],
  "emissions_": null,
  "name": ""
}