{
  "$type": "Il2CppAssets.Scripts.Models.Rounds.RoundModel, Assembly-CSharp",
  "groups": [
    {
      "$type": "Il2CppAssets.Scripts.Models.Rounds.BloonGroupModel, Assembly-CSharp",
      "bloon": "MoabFortified",
      "start": 0.0,
      "end": 1800.0,
      "count": 28,
      "name": ""
    },
    {
      "$type": "Il2CppAssets.Scripts.Models.Rounds.BloonGroupModel, Assembly-CSharp",
      "bloon": "DdtFortifiedCamo",
      "start": 300.0,
      "end": 1800.0,
      "count": 14,
      "name": ""
    },
    {
      "$type": "Il2CppAssets.Scripts.Models.Rounds.BloonGroupModel, Assembly-CSharp",
      "bloon": "BfbFortified",
      "start": 600.0,
      "end": 1800.0,
      "count": 7,
      "name": ""
    },
    {
      "$type": "Il2CppAssets.Scripts.Models.Rounds.BloonGroupModel, Assembly-CSharp",
      "bloon": "ZomgFortified",
      "start": 900.0,
      "end": 1800.0,
      "count": 4,
      "name": ""
    },
    {
      "$type": "Il2CppAssets.Scripts.Models.Rounds.BloonGroupModel, Assembly-CSharp",
      "bloon": "PurpleCamo",
      "start": 0.0,
      "end": 1800.0,
      "count": 10,
      "name": ""
    },
    {
      "$type": "Il2CppAssets.Scripts.Models.Rounds.BloonGroupModel, Assembly-CSharp",
      "bloon": "GreenCamo",
      "start": 300.0,
      "end": 1800.0,
      "count": 10,
      "name": ""
    },
    {
      "$type": "Il2CppAssets.Scripts.Models.Rounds.BloonGroupModel, Assembly-CSharp",
      "bloon": "BlackCamo",
      "start": 600.0,
      "end": 1800.0,
      "count": 10,
      "name": ""
    },
    {
      "$type": "Il2CppAssets.Scripts.Models.Rounds.BloonGroupModel, Assembly-CSharp",
      "bloon": "BlueCamo",
      "start": 900.0,
      "end": 1800.0,
      "count": 10,
      "name": ""
    },
    {
      "$type": "Il2CppAssets.Scripts.Models.Rounds.BloonGroupModel, Assembly-CSharp",
      "bloon": "BadFortified",
      "start": 1200.0,
      "end": 1800.0,
      "count": 2,
      "name": ""
    },
    {
      "$type": "Il2CppAssets.Scripts.Models.Rounds.BloonGroupModel, Assembly-CSharp",
      "bloon": "Bad",
      "start": 0.0,
      "end": 1800.0,
      "count": 1,
      "name": ""
    }
  ],
  "emissions_": null,
  "name": ""
}