{
  "$type": "Il2CppAssets.Scripts.Models.Rounds.RoundModel, Assembly-CSharp",
  "groups": [
    {
      "$type": "Il2CppAssets.Scripts.Models.Rounds.BloonGroupModel, Assembly-CSharp",
      "bloon": "Red",
      "start": 0.0,
      "end": 1500.0,
      "count": 20,
      "name": ""
    },
    {
      "$type": "Il2CppAssets.Scripts.Models.Rounds.BloonGroupModel, Assembly-CSharp",
      "bloon": "Moab",
      "start": 1053.0,
      "end": 1233.0,
      "count": 3,
      "name": ""
    },
    {
      "$type": "Il2CppAssets.Scripts.Models.Rounds.BloonGroupModel, Assembly-CSharp",
      "bloon": "Green",
      "start": 340.8,
      "end": 1240.8,
      "count": 12,
      "name": ""
    },
    {
      "$type": "Il2CppAssets.Scripts.Models.Rounds.BloonGroupModel, Assembly-CSharp",
      "bloon": "Yellow",
      "start": 532.2,
      "end": 1252.2,
      "count": 10,
      "name": ""
    },
    {
      "$type": "Il2CppAssets.Scripts.Models.Rounds.BloonGroupModel, Assembly-CSharp",
      "bloon": "Blue",
      "start": 166.8,
      "end": 1366.8,
      "count": 15,
      "name": ""
    }
  ],
  "emissions_": null,
  "name": ""
}