{
  "$type": "Il2CppAssets.Scripts.Models.Rounds.RoundModel, Assembly-CSharp",
  "groups": [
    {
      "$type": "Il2CppAssets.Scripts.Models.Rounds.BloonGroupModel, Assembly-CSharp",
      "bloon": "White",
      "start": 0.0,
      "end": 408.0,
      "count": 25,
      "name": ""
    },
    {
      "$type": "Il2CppAssets.Scripts.Models.Rounds.BloonGroupModel, Assembly-CSharp",
      "bloon": "Rainbow",
      "start": 612.00006,
      "end": 714.00006,
      "count": 5,
      "name": ""
    },
    {
      "$type": "Il2CppAssets.Scripts.Models.Rounds.BloonGroupModel, Assembly-CSharp",
      "bloon": "Pink",
      "start": 867.00006,
      "end": 1173.0001,
      "count": 35,
      "name": ""
    },
    {
      "$type": "Il2CppAssets.Scripts.Models.Rounds.BloonGroupModel, Assembly-CSharp",
      "bloon": "Black",
      "start": 1173.0001,
      "end": 1479.0001,
      "count": 30,
      "name": ""
    }
  ],
  "emissions_": null,
  "name": ""
}