{
  "$type": "Il2CppAssets.Scripts.Models.Rounds.RoundModel, Assembly-CSharp",
  "groups": [
    {
      "$type": "Il2CppAssets.Scripts.Models.Rounds.BloonGroupModel, Assembly-CSharp",
      "bloon": "LeadFortifiedCamo",
      "start": 0.0,
      "end": 1800.0,
      "count": 210,
      "name": ""
    },
    {
      "$type": "Il2CppAssets.Scripts.Models.Rounds.BloonGroupModel, Assembly-CSharp",
      "bloon": "DdtCamo",
      "start": 0.0,
      "end": 1500.0,
      "count": 27,
      "name": ""
    },
    {
      "$type": "Il2CppAssets.Scripts.Models.Rounds.BloonGroupModel, Assembly-CSharp",
      "bloon": "DdtCamo",
      "start": 0.0,
      "end": 1200.0,
      "count": 27,
      "name": ""
    },
    {
      "$type": "Il2CppAssets.Scripts.Models.Rounds.BloonGroupModel, Assembly-CSharp",
      "bloon": "DdtCamo",
      "start": 0.0,
      "end": 900.0,
      "count": 27,
      "name": ""
    },
    {
      "$type": "Il2CppAssets.Scripts.Models.Rounds.BloonGroupModel, Assembly-CSharp",
      "bloon": "DdtCamo",
      "start": 0.0,
      "end": 600.0,
      "count": 27,
      "name": ""
    },
    {
      "$type": "Il2CppAssets.Scripts.Models.Rounds.BloonGroupModel, Assembly-CSharp",
      "bloon": "DdtCamo",
      "start": 0.0,
      "end": 300.0,
      "count": 27,
      "name": ""
    },
    {
      "$type": "Il2CppAssets.Scripts.Models.Rounds.BloonGroupModel, Assembly-CSharp",
      "bloon": "ZomgFortified",
      "start": 1500.0,
      "end": 1800.0,
      "count": 5,
      "name": ""
    },
    {
      "$type": "Il2CppAssets.Scripts.Models.Rounds.BloonGroupModel, Assembly-CSharp",
      "bloon": "Bad",
      "start": 0.0,
      "end": 1800.0,
      "count": 1,
      "name": ""
    }
  ],
  "emissions_": null,
  "name": ""
}