{
  "$type": "Il2CppAssets.Scripts.Models.Rounds.RoundModel, Assembly-CSharp",
  "groups": [
    {
      "$type": "Il2CppAssets.Scripts.Models.Rounds.BloonGroupModel, Assembly-CSharp",
      "bloon": "Lead",
      "start": 0.0,
      "end": 612.00006,
      "count": 10,
      "name": ""
    },
    {
      "$type": "Il2CppAssets.Scripts.Models.Rounds.BloonGroupModel, Assembly-CSharp",
      "bloon": "Rainbow",
      "start": 51.0,
      "end": 663.0,
      "count": 10,
      "name": ""
    }
  ],
  "emissions_": null,
  "name": ""
}