{
  "$type": "Il2CppAssets.Scripts.Models.Rounds.RoundModel, Assembly-CSharp",
  "groups": [
    {
      "$type": "Il2CppAssets.Scripts.Models.Rounds.BloonGroupModel, Assembly-CSharp",
      "bloon": "Moab",
      "start": 0.0,
      "end": 1800.0,
      "count": 3,
      "name": ""
    },
    {
      "$type": "Il2CppAssets.Scripts.Models.Rounds.BloonGroupModel, Assembly-CSharp",
      "bloon": "GreenCamo",
      "start": 60.0,
      "end": 960.0,
      "count": 24,
      "name": ""
    },
    {
      "$type": "Il2CppAssets.Scripts.Models.Rounds.BloonGroupModel, Assembly-CSharp",
      "bloon": "ZebraCamo",
      "start": 900.0,
      "end": 1200.0,
      "count": 5,
      "name": ""
    },
    {
      "$type": "Il2CppAssets.Scripts.Models.Rounds.BloonGroupModel, Assembly-CSharp",
      "bloon": "Rainbow",
      "start": 1140.0,
      "end": 1800.0,
      "count": 7,
      "name": ""
    }
  ],
  "emissions_": null,
  "name": ""
}