{
  "$type": "Il2CppAssets.Scripts.Models.Rounds.RoundModel, Assembly-CSharp",
  "groups": [
    {
      "$type": "Il2CppAssets.Scripts.Models.Rounds.BloonGroupModel, Assembly-CSharp",
      "bloon": "MoabFortified",
      "start": 0.0,
      "end": 1200.0,
      "count": 53,
      "name": ""
    },
    {
      "$type": "Il2CppAssets.Scripts.Models.Rounds.BloonGroupModel, Assembly-CSharp",
      "bloon": "DdtCamo",
      "start": 0.0,
      "end": 1200.0,
      "count": 18,
      "name": ""
    },
    {
      "$type": "Il2CppAssets.Scripts.Models.Rounds.BloonGroupModel, Assembly-CSharp",
      "bloon": "Bfb",
      "start": 0.0,
      "end": 1200.0,
      "count": 9,
      "name": ""
    },
    {
      "$type": "Il2CppAssets.Scripts.Models.Rounds.BloonGroupModel, Assembly-CSharp",
      "bloon": "Zomg",
      "start": 400.2,
      "end": 1200.0,
      "count": 4,
      "name": ""
    }
  ],
  "emissions_": null,
  "name": ""
}