{
  "$type": "Il2CppAssets.Scripts.Models.Rounds.RoundModel, Assembly-CSharp",
  "groups": [
    {
      "$type": "Il2CppAssets.Scripts.Models.Rounds.BloonGroupModel, Assembly-CSharp",
      "bloon": "AuraBloon",
      "start": 0.0,
      "end": 300.0,
      "count": 12,
      "name": ""
    },
    {
      "$type": "Il2CppAssets.Scripts.Models.Rounds.BloonGroupModel, Assembly-CSharp",
      "bloon": "YellowCamo",
      "start": 0.0,
      "end": 300.0,
      "count": 99,
      "name": ""
    },
    {
      "$type": "Il2CppAssets.Scripts.Models.Rounds.BloonGroupModel, Assembly-CSharp",
      "bloon": "Bfb",
      "start": 0.0,
      "end": 300.0,
      "count": 6,
      "name": ""
    },
    {
      "$type": "Il2CppAssets.Scripts.Models.Rounds.BloonGroupModel, Assembly-CSharp",
      "bloon": "Zomg",
      "start": 0.0,
      "end": 60.0,
      "count": 1,
      "name": ""
    }
  ],
  "emissions_": null,
  "name": ""
}