{
  "$type": "Il2CppAssets.Scripts.Models.Rounds.RoundModel, Assembly-CSharp",
  "groups": [
    {
      "$type": "Il2CppAssets.Scripts.Models.Rounds.BloonGroupModel, Assembly-CSharp",
      "bloon": "Yellow",
      "start": 0.0,
      "end": 300.0,
      "count": 150,
      "name": ""
    },
    {
      "$type": "Il2CppAssets.Scripts.Models.Rounds.BloonGroupModel, Assembly-CSharp",
      "bloon": "Pink",
      "start": 300.0,
      "end": 600.0,
      "count": 150,
      "name": ""
    },
    {
      "$type": "Il2CppAssets.Scripts.Models.Rounds.BloonGroupModel, Assembly-CSharp",
      "bloon": "Black",
      "start": 600.0,
      "end": 900.0,
      "count": 75,
      "name": ""
    },
    {
      "$type": "Il2CppAssets.Scripts.Models.Rounds.BloonGroupModel, Assembly-CSharp",
      "bloon": "White",
      "start": 900.0,
      "end": 1200.0,
      "count": 75,
      "name": ""
    },
    {
      "$type": "Il2CppAssets.Scripts.Models.Rounds.BloonGroupModel, Assembly-CSharp",
      "bloon": "Purple",
      "start": 1200.0,
      "end": 1500.0,
      "count": 75,
      "name": ""
    },
    {
      "$type": "Il2CppAssets.Scripts.Models.Rounds.BloonGroupModel, Assembly-CSharp",
      "bloon": "Zebra",
      "start": 1500.0,
      "end": 1800.0,
      "count": 75,
      "name": ""
    }
  ],
  "emissions_": null,
  "name": ""
}