{
  "$type": "Il2CppAssets.Scripts.Models.Rounds.RoundModel, Assembly-CSharp",
  "groups": [
    {
      "$type": "Il2CppAssets.Scripts.Models.Rounds.BloonGroupModel, Assembly-CSharp",
      "bloon": "ZomgFortified",
      "start": 420.0,
      "end": 780.0,
      "count": 9,
      "name": ""
    },
    {
      "$type": "Il2CppAssets.Scripts.Models.Rounds.BloonGroupModel, Assembly-CSharp",
      "bloon": "Zomg",
      "start": 0.0,
      "end": 780.0,
      "count": 17,
      "name": ""
    },
    {
      "$type": "Il2CppAssets.Scripts.Models.Rounds.BloonGroupModel, Assembly-CSharp",
      "bloon": "Zomg",
      "start": 990.0,
      "end": 1110.0,
      "count": 5,
      "name": ""
    }
  ],
  "emissions_": null,
  "name": ""
}