{
  "$type": "Il2CppAssets.Scripts.Models.Rounds.RoundModel, Assembly-CSharp",
  "groups": [
    {
      "$type": "Il2CppAssets.Scripts.Models.Rounds.BloonGroupModel, Assembly-CSharp",
      "bloon": "Lead",
      "start": 0.0,
      "end": 307.80002,
      "count": 10,
      "name": ""
    },
    {
      "$type": "Il2CppAssets.Scripts.Models.Rounds.BloonGroupModel, Assembly-CSharp",
      "bloon": "Blue",
      "start": 342.0,
      "end": 706.2,
      "count": 15,
      "name": ""
    },
    {
      "$type": "Il2CppAssets.Scripts.Models.Rounds.BloonGroupModel, Assembly-CSharp",
      "bloon": "Ceramic",
      "start": 856.2,
      "end": 1043.196,
      "count": 5,
      "name": ""
    }
  ],
  "emissions_": null,
  "name": ""
}