{
  "$type": "Il2CppAssets.Scripts.Models.Rounds.RoundModel, Assembly-CSharp",
  "groups": [
    {
      "$type": "Il2CppAssets.Scripts.Models.Rounds.BloonGroupModel, Assembly-CSharp",
      "bloon": "Rainbow",
      "start": 0.0,
      "end": 540.0,
      "count": 2,
      "name": ""
    },
    {
      "$type": "Il2CppAssets.Scripts.Models.Rounds.BloonGroupModel, Assembly-CSharp",
      "bloon": "Bfb",
      "start": 270.0,
      "end": 540.0,
      "count": 2,
      "name": ""
    },
    {
      "$type": "Il2CppAssets.Scripts.Models.Rounds.BloonGroupModel, Assembly-CSharp",
      "bloon": "Ceramic",
      "start": 0.0,
      "end": 540.0,
      "count": 2,
      "name": ""
    },
    {
      "$type": "Il2CppAssets.Scripts.Models.Rounds.BloonGroupModel, Assembly-CSharp",
      "bloon": "Moab",
      "start": 0.0,
      "end": 60.0,
      "count": 1,
      "name": ""
    }
  ],
  "emissions_": null,
  "name": ""
}