{
  "$type": "Il2CppAssets.Scripts.Models.Rounds.RoundModel, Assembly-CSharp",
  "groups": [
    {
      "$type": "Il2CppAssets.Scripts.Models.Rounds.BloonGroupModel, Assembly-CSharp",
      "bloon": "PinkRegrow",
      "start": 0.0,
      "end": 900.0,
      "count": 80,
      "name": ""
    },
    {
      "$type": "Il2CppAssets.Scripts.Models.Rounds.BloonGroupModel, Assembly-CSharp",
      "bloon": "PurpleRegrowCamo",
      "start": 900.0,
      "end": 1800.0,
      "count": 30,
      "name": ""
    },
    {
      "$type": "Il2CppAssets.Scripts.Models.Rounds.BloonGroupModel, Assembly-CSharp",
      "bloon": "Rainbow",
      "start": 1800.0,
      "end": 3000.0,
      "count": 80,
      "name": ""
    },
    {
      "$type": "Il2CppAssets.Scripts.Models.Rounds.BloonGroupModel, Assembly-CSharp",
      "bloon": "CeramicFortified",
      "start": 2700.0,
      "end": 3000.0,
      "count": 30,
      "name": ""
    },
    {
      "$type": "Il2CppAssets.Scripts.Models.Rounds.BloonGroupModel, Assembly-CSharp",
      "bloon": "Moab",
      "start": 360.0,
      "end": 1560.0,
      "count": 4,
      "name": ""
    },
    {
      "$type": "Il2CppAssets.Scripts.Models.Rounds.BloonGroupModel, Assembly-CSharp",
      "bloon": "Bfb",
      "start": 60.0,
      "end": 960.0,
      "count": 3,
      "name": ""
    },
    {
      "$type": "Il2CppAssets.Scripts.Models.Rounds.BloonGroupModel, Assembly-CSharp",
      "bloon": "Bfb",
      "start": 2400.0,
      "end": 3000.0,
      "count": 6,
      "name": ""
    }
  ],
  "emissions_": null,
  "name": ""
}