{
  "$type": "Il2CppAssets.Scripts.Models.Rounds.RoundModel, Assembly-CSharp",
  "groups": [
    {
      "$type": "Il2CppAssets.Scripts.Models.Rounds.BloonGroupModel, Assembly-CSharp",
      "bloon": "BfbFortified",
      "start": 0.0,
      "end": 60.0,
      "count": 1,
      "name": ""
    }
  ],
  "emissions_": null,
  "name": ""
}