{
  "$type": "Il2CppAssets.Scripts.Models.Rounds.RoundModel, Assembly-CSharp",
  "groups": [
    {
      "$type": "Il2CppAssets.Scripts.Models.Rounds.BloonGroupModel, Assembly-CSharp",
      "bloon": "ZebraRegrow",
      "start": 0.0,
      "end": 240.0,
      "count": 10,
      "name": ""
    },
    {
      "$type": "Il2CppAssets.Scripts.Models.Rounds.BloonGroupModel, Assembly-CSharp",
      "bloon": "Pink",
      "start": 319.8,
      "end": 919.8,
      "count": 25,
      "name": ""
    },
    {
      "$type": "Il2CppAssets.Scripts.Models.Rounds.BloonGroupModel, Assembly-CSharp",
      "bloon": "Yellow",
      "start": 648.0,
      "end": 1248.0,
      "count": 75,
      "name": ""
    }
  ],
  "emissions_": null,
  "name": ""
}