{
  "$type": "Il2CppAssets.Scripts.Models.Rounds.RoundModel, Assembly-CSharp",
  "groups": [
    {
      "$type": "Il2CppAssets.Scripts.Models.Rounds.BloonGroupModel, Assembly-CSharp",
      "bloon": "PinkRegrow",
      "start": 0.0,
      "end": 840.0,
      "count": 22,
      "name": ""
    },
    {
      "$type": "Il2CppAssets.Scripts.Models.Rounds.BloonGroupModel, Assembly-CSharp",
      "bloon": "PurpleRegrow",
      "start": 1028.3999,
      "end": 1268.3999,
      "count": 10,
      "name": ""
    }
  ],
  "emissions_": null,
  "name": ""
}