{
  "$type": "Il2CppAssets.Scripts.Models.Rounds.RoundModel, Assembly-CSharp",
  "groups": [
    {
      "$type": "Il2CppAssets.Scripts.Models.Rounds.BloonGroupModel, Assembly-CSharp",
      "bloon": "Bad",
      "start": 0.0,
      "end": 3600.0,
      "count": 1,
      "name": ""
    },
    {
      "$type": "Il2CppAssets.Scripts.Models.Rounds.BloonGroupModel, Assembly-CSharp",
      "bloon": "DynamiteBloon",
      "start": 0.0,
      "end": 3600.0,
      "count": 90,
      "name": ""
    },
    {
      "$type": "Il2CppAssets.Scripts.Models.Rounds.BloonGroupModel, Assembly-CSharp",
      "bloon": "GlassBloon",
      "start": 0.0,
      "end": 3600.0,
      "count": 15,
      "name": ""
    }
  ],
  "emissions_": null,
  "name": ""
}