{
  "$type": "Il2CppAssets.Scripts.Models.Rounds.RoundModel, Assembly-CSharp",
  "groups": [
    {
      "$type": "Il2CppAssets.Scripts.Models.Rounds.BloonGroupModel, Assembly-CSharp",
      "bloon": "Bad",
      "start": 0.0,
      "end": 480.0,
      "count": 2,
      "name": ""
    },
    {
      "$type": "Il2CppAssets.Scripts.Models.Rounds.BloonGroupModel, Assembly-CSharp",
      "bloon": "Zomg",
      "start": 240.0,
      "end": 1440.0,
      "count": 3,
      "name": ""
    },
    {
      "$type": "Il2CppAssets.Scripts.Models.Rounds.BloonGroupModel, Assembly-CSharp",
      "bloon": "Pink",
      "start": 240.0,
      "end": 480.0,
      "count": 33,
      "name": ""
    },
    {
      "$type": "Il2CppAssets.Scripts.Models.Rounds.BloonGroupModel, Assembly-CSharp",
      "bloon": "PinkRegrow",
      "start": 480.0,
      "end": 720.0,
      "count": 33,
      "name": ""
    },
    {
      "$type": "Il2CppAssets.Scripts.Models.Rounds.BloonGroupModel, Assembly-CSharp",
      "bloon": "PinkCamo",
      "start": 720.0,
      "end": 960.0,
      "count": 33,
      "name": ""
    },
    {
      "$type": "Il2CppAssets.Scripts.Models.Rounds.BloonGroupModel, Assembly-CSharp",
      "bloon": "PinkRegrowCamo",
      "start": 960.0,
      "end": 1200.0,
      "count": 66,
      "name": ""
    }
  ],
  "emissions_": null,
  "name": ""
}